{
  "formatVersion": "1",
  "header": {
    "description": "Testing CDBO  saw2",
    "originalLanguage": "en",
    "abapLanguageVersion": "cloudDevelopment"
  },
  "generalInformation": {
    "objectType": "TABL",
    "objectName": "CDB_ADT_TEST"
  },
  "fields": [
    {
      "name": "CLIENT",
      "nature": "nonBusinessInformation"
    },
    {
      "name": "TIME",
      "nature": "general"
    },
    {
      "name": "DATUM",
      "nature": "general"
    }
  ]
}
